{
  "$schema": "https://json-schema.org/draft/2020-12/schema",
  "$id": "https://ramals.io/perf/baseline.schema.json",
  "title": "RAMALS MVP-0 performance baseline",
  "description": "Machine-readable baseline result. Every published baseline records stable environment metadata so runs are comparable and regressions are judged against data, not one-off numbers.",
  "type": "object",
  "additionalProperties": false,
  "required": [
    "scenario",
    "executor_model",
    "environment",
    "commit",
    "dataset_version",
    "script_version",
    "measured_at",
    "steady_state",
    "latency_ms",
    "error_rate",
    "throughput_rps",
    "thresholds_passed",
    "k6_exit_status",
    "performance_rate_limit_override"
  ],
  "properties": {
    "scenario": {
      "type": "string",
      "examples": [
        "mixed-learning",
        "diagnostic",
        "auth",
        "concurrency-idempotency"
      ]
    },
    "executor_model": {
      "type": "string",
      "enum": [
        "open",
        "closed"
      ]
    },
    "executor": {
      "type": "string",
      "enum": [
        "constant-arrival-rate",
        "ramping-arrival-rate",
        "constant-vus",
        "per-vu-iterations"
      ]
    },
    "environment": {
      "type": "string",
      "description": "Authoritative fixed-spec env id, e.g. perf-standard-01. 'local-unqualified' marks informational runs. Any other value requires environment_attestation: the id is earned by a host measured against performance/environment/<id>.json, not asserted by a variable."
    },
    "commit": {
      "type": "string"
    },
    "dataset_version": {
      "type": "string"
    },
    "script_version": {
      "type": "string"
    },
    "measured_at": {
      "type": "string",
      "format": "date-time"
    },
    "arrival_rate_rps": {
      "type": "number"
    },
    "observed_concurrency": {
      "type": "number"
    },
    "think_time_ms": {
      "type": "number"
    },
    "warmup_discarded": {
      "type": "boolean"
    },
    "steady_state": {
      "type": "object",
      "required": [
        "window"
      ],
      "properties": {
        "window": {
          "type": "string"
        }
      }
    },
    "host": {
      "type": "object",
      "properties": {
        "cpu_limit": {
          "type": "string"
        },
        "memory_limit": {
          "type": "string"
        },
        "jvm": {
          "type": "string"
        },
        "db_version": {
          "type": "string"
        }
      }
    },
    "latency_ms": {
      "type": "object",
      "required": [
        "p50",
        "p95",
        "p99"
      ],
      "properties": {
        "p50": {
          "type": "number"
        },
        "p95": {
          "type": "number"
        },
        "p99": {
          "type": [
            "number",
            "null"
          ],
          "description": "null means the run did not capture p99, not that it was zero. k6's summary export emits only avg/min/med/max/p(90)/p(95) unless --summary-trend-stats asks for more; runs before the harness did so have no p99 to record. The key stays required so its absence is a deliberate statement rather than an omission."
        }
      }
    },
    "adaptive_decision_latency_ms": {
      "type": [
        "object",
        "null"
      ],
      "properties": {
        "p50": {
          "type": "number"
        },
        "p95": {
          "type": "number"
        },
        "p99": {
          "type": "number"
        }
      },
      "description": "null when the scenario does not measure adaptive decision latency. Only the diagnostic scenario does."
    },
    "error_rate": {
      "type": "number"
    },
    "throughput_rps": {
      "type": "number"
    },
    "environment_attestation": {
      "type": "object",
      "description": "What the host was measured to be at the moment of the run. Present only for a qualified environment id, and its absence is the answer to whether a baseline was calibrated -- run-baseline.sh cannot write a qualified id without it.",
      "required": [
        "specId",
        "conforms",
        "measured",
        "attestedAt"
      ],
      "properties": {
        "specId": {
          "type": "string"
        },
        "specVersion": {
          "type": "string"
        },
        "specStatus": {
          "type": "string"
        },
        "attestedAt": {
          "type": "string",
          "format": "date-time"
        },
        "conforms": {
          "const": true,
          "description": "A non-conforming run is never recorded under a qualified id."
        },
        "failures": {
          "type": "array",
          "items": {
            "type": "string"
          }
        },
        "measured": {
          "type": "object"
        }
      }
    },
    "thresholds_passed": {
      "type": "boolean",
      "description": "Whether every k6 threshold held. A baseline may record a FAIL; that is the point. Required unconditionally: an exemption keyed on any field of this document would be one the document could claim for itself. Baselines written before these fields existed are validated against the relaxed contract by an explicit path allowlist in scripts/ci/test-perf-attestation.sh, which a new file cannot enter by editing its own contents."
    },
    "k6_exit_status": {
      "type": "integer",
      "description": "k6's exit status, preserved so a non-threshold failure is distinguishable from a breached threshold."
    },
    "performance_rate_limit_override": {
      "type": "boolean",
      "description": "Whether performance/compose.perf-override.yml was active. A capacity run and a production-policy run produce very different numbers from an identical workload, and are otherwise indistinguishable once console output is gone."
    }
  },
  "allOf": [
    {
      "$comment": "The rule R1 exists for: an environment id other than local-unqualified is only valid alongside the attestation that earned it.",
      "if": {
        "properties": {
          "environment": {
            "not": {
              "const": "local-unqualified"
            }
          }
        }
      },
      "then": {
        "required": [
          "environment_attestation"
        ]
      }
    }
  ]
}
